{
  "provider": "Moonshot AI",
  "slug": "moonshot-ai",
  "category": "llm",
  "homepage": "https://moonshot.ai",
  "pricing_url": "https://platform.moonshot.ai/docs/pricing",
  "currency": "USD",
  "verified_at": "2026-09-12",
  "source": "openrouter",
  "notes": "Per-token rates as listed on OpenRouter; cross-check headline models against the provider's own pricing page.",
  "rates": [
    {
      "item": "kimi-k2.5",
      "unit": "1M tokens",
      "input": 0.45,
      "output": 2.25,
      "cached_input": 0.07
    },
    {
      "item": "kimi-k2",
      "unit": "1M tokens",
      "input": 0.57,
      "output": 2.3
    },
    {
      "item": "kimi-k2-thinking",
      "unit": "1M tokens",
      "input": 0.6,
      "output": 2.5
    },
    {
      "item": "kimi-k2-0905",
      "unit": "1M tokens",
      "input": 0.6,
      "output": 2.5
    },
    {
      "item": "kimi-k2.7-code",
      "unit": "1M tokens",
      "input": 0.71,
      "output": 3.5,
      "cached_input": 0.15
    },
    {
      "item": "kimi-k2.6",
      "unit": "1M tokens",
      "input": 0.95,
      "output": 4,
      "cached_input": 0.16
    },
    {
      "item": "kimi-k3",
      "unit": "1M tokens",
      "input": 2.6481,
      "output": 13.2827,
      "cached_input": 0.3026
    }
  ]
}
