{
  "provider": "Qwen (Alibaba)",
  "slug": "qwen-alibaba",
  "category": "llm",
  "homepage": "https://qwen.ai",
  "pricing_url": "https://www.alibabacloud.com/help/en/model-studio/models",
  "currency": "USD",
  "verified_at": "2026-09-10",
  "source": "openrouter",
  "notes": "Per-token rates as listed on OpenRouter; cross-check headline models against the provider's own pricing page.",
  "rates": [
    {
      "item": "qwen3.7-flash",
      "unit": "1M tokens",
      "input": 0.03,
      "output": 0.13,
      "cached_input": 0.006
    },
    {
      "item": "qwen3-30b-a3b-instruct-2507",
      "unit": "1M tokens",
      "input": 0.0481,
      "output": 0.193
    },
    {
      "item": "qwen3.5-flash-02-23",
      "unit": "1M tokens",
      "input": 0.065,
      "output": 0.26
    },
    {
      "item": "qwen3-coder-30b-a3b-instruct",
      "unit": "1M tokens",
      "input": 0.07,
      "output": 0.28
    },
    {
      "item": "qwen3-32b",
      "unit": "1M tokens",
      "input": 0.08,
      "output": 0.28
    },
    {
      "item": "qwen3-next-80b-a3b-instruct",
      "unit": "1M tokens",
      "input": 0.09,
      "output": 1.1
    },
    {
      "item": "qwen3.6-35b-a3b",
      "unit": "1M tokens",
      "input": 0.1,
      "output": 0.9,
      "cached_input": 0.05
    },
    {
      "item": "qwen3.5-9b",
      "unit": "1M tokens",
      "input": 0.1,
      "output": 0.15
    },
    {
      "item": "qwen-2.5-7b-instruct",
      "unit": "1M tokens",
      "input": 0.1,
      "output": 0.2
    },
    {
      "item": "qwen3-vl-32b-instruct",
      "unit": "1M tokens",
      "input": 0.104,
      "output": 0.416
    },
    {
      "item": "qwen3-vl-8b-instruct",
      "unit": "1M tokens",
      "input": 0.117,
      "output": 0.455
    },
    {
      "item": "qwen3-8b",
      "unit": "1M tokens",
      "input": 0.117,
      "output": 0.455
    },
    {
      "item": "qwen3-coder-next",
      "unit": "1M tokens",
      "input": 0.12,
      "output": 0.8,
      "cached_input": 0.07
    },
    {
      "item": "qwen3-30b-a3b",
      "unit": "1M tokens",
      "input": 0.12,
      "output": 0.5
    },
    {
      "item": "qwen3.8-flash",
      "unit": "1M tokens",
      "input": 0.15,
      "output": 0.47,
      "cached_input": 0.016
    },
    {
      "item": "qwen3-vl-30b-a3b-instruct",
      "unit": "1M tokens",
      "input": 0.15,
      "output": 0.6
    },
    {
      "item": "qwen3-next-80b-a3b-thinking",
      "unit": "1M tokens",
      "input": 0.15,
      "output": 1.2
    },
    {
      "item": "qwen3-vl-8b-thinking",
      "unit": "1M tokens",
      "input": 0.18,
      "output": 2.1
    },
    {
      "item": "qwen3.6-flash",
      "unit": "1M tokens",
      "input": 0.1875,
      "output": 1.125
    },
    {
      "item": "qwen3.5-27b",
      "unit": "1M tokens",
      "input": 0.195,
      "output": 1.56
    },
    {
      "item": "qwen3-coder-flash",
      "unit": "1M tokens",
      "input": 0.195,
      "output": 0.975,
      "cached_input": 0.039
    },
    {
      "item": "qwen3-vl-30b-a3b-thinking",
      "unit": "1M tokens",
      "input": 0.2,
      "output": 2.4
    },
    {
      "item": "qwen3-30b-a3b-thinking-2507",
      "unit": "1M tokens",
      "input": 0.2,
      "output": 2.4
    },
    {
      "item": "qwen3-vl-235b-a22b-instruct",
      "unit": "1M tokens",
      "input": 0.21,
      "output": 1.9,
      "cached_input": 0.1
    },
    {
      "item": "qwen3-235b-a22b-2507",
      "unit": "1M tokens",
      "input": 0.22,
      "output": 0.88
    },
    {
      "item": "qwen3-14b",
      "unit": "1M tokens",
      "input": 0.2275,
      "output": 0.91
    },
    {
      "item": "qwen3-235b-a22b-thinking-2507",
      "unit": "1M tokens",
      "input": 0.23,
      "output": 2.3
    },
    {
      "item": "qwen3.5-122b-a10b",
      "unit": "1M tokens",
      "input": 0.26,
      "output": 2.08
    },
    {
      "item": "qwen3.5-plus-02-15",
      "unit": "1M tokens",
      "input": 0.26,
      "output": 1.56
    },
    {
      "item": "qwen-plus-2025-07-28",
      "unit": "1M tokens",
      "input": 0.26,
      "output": 0.78
    }
  ]
}
