{
  "provider": "Mistral",
  "slug": "mistral",
  "category": "llm",
  "homepage": "https://mistral.ai",
  "pricing_url": "https://mistral.ai/pricing",
  "currency": "USD",
  "verified_at": "2026-09-10",
  "source": "openrouter",
  "notes": "Per-token rates as listed on OpenRouter; cross-check headline models against the provider's own pricing page.",
  "rates": [
    {
      "item": "mistral-nemo",
      "unit": "1M tokens",
      "input": 0.019,
      "output": 0.03
    },
    {
      "item": "mistral-small-24b-instruct-2501",
      "unit": "1M tokens",
      "input": 0.05,
      "output": 0.08
    },
    {
      "item": "mistral-small-3.2-24b-instruct",
      "unit": "1M tokens",
      "input": 0.075,
      "output": 0.2
    },
    {
      "item": "ministral-3b-2512",
      "unit": "1M tokens",
      "input": 0.1,
      "output": 0.1,
      "cached_input": 0.01
    },
    {
      "item": "voxtral-small-24b-2507",
      "unit": "1M tokens",
      "input": 0.1,
      "output": 0.3,
      "cached_input": 0.01
    },
    {
      "item": "mistral-small-2603",
      "unit": "1M tokens",
      "input": 0.15,
      "output": 0.6,
      "cached_input": 0.015
    },
    {
      "item": "ministral-8b-2512",
      "unit": "1M tokens",
      "input": 0.15,
      "output": 0.15,
      "cached_input": 0.015
    },
    {
      "item": "ministral-14b-2512",
      "unit": "1M tokens",
      "input": 0.2,
      "output": 0.2,
      "cached_input": 0.02
    },
    {
      "item": "mistral-saba",
      "unit": "1M tokens",
      "input": 0.2,
      "output": 0.6,
      "cached_input": 0.02
    },
    {
      "item": "codestral-2508",
      "unit": "1M tokens",
      "input": 0.3,
      "output": 0.9,
      "cached_input": 0.03
    },
    {
      "item": "mistral-small-3.1-24b-instruct",
      "unit": "1M tokens",
      "input": 0.351,
      "output": 0.555
    },
    {
      "item": "devstral-2512",
      "unit": "1M tokens",
      "input": 0.4,
      "output": 2,
      "cached_input": 0.04
    },
    {
      "item": "mistral-medium-3.1",
      "unit": "1M tokens",
      "input": 0.4,
      "output": 2,
      "cached_input": 0.04
    },
    {
      "item": "mistral-medium-3",
      "unit": "1M tokens",
      "input": 0.4,
      "output": 2,
      "cached_input": 0.04
    },
    {
      "item": "mistral-large-2512",
      "unit": "1M tokens",
      "input": 0.5,
      "output": 1.5,
      "cached_input": 0.05
    },
    {
      "item": "mistral-medium-3-5",
      "unit": "1M tokens",
      "input": 1.5,
      "output": 7.5
    },
    {
      "item": "mistral-large-2407",
      "unit": "1M tokens",
      "input": 2,
      "output": 6,
      "cached_input": 0.2
    },
    {
      "item": "mixtral-8x22b-instruct",
      "unit": "1M tokens",
      "input": 2,
      "output": 6,
      "cached_input": 0.2
    },
    {
      "item": "mistral-large",
      "unit": "1M tokens",
      "input": 2,
      "output": 6,
      "cached_input": 0.2
    }
  ]
}
