{
  "provider": "Postmark",
  "slug": "postmark",
  "category": "messaging",
  "homepage": "https://postmarkapp.com",
  "pricing_url": "https://postmarkapp.com/pricing",
  "currency": "USD",
  "verified_at": "2026-09-12",
  "source": "manual",
  "notes": "Tiered monthly plans. Effective-rate line divides the Basic tier's $15/mo by its 10,000 included emails; plan and overage rates are listed as their own line items so every figure a comparison would cite is a real, sourced number.",
  "rates": [
    { "item": "Free plan", "unit": "month", "rate": 0, "notes": "100 emails/mo included" },
    { "item": "Basic plan", "unit": "month", "rate": 15, "notes": "10,000 emails/mo included" },
    { "item": "Pro plan", "unit": "month", "rate": 16.5, "notes": "10,000 emails/mo included" },
    { "item": "Platform plan", "unit": "month", "rate": 18, "notes": "10,000 emails/mo included" },
    { "item": "Overage, Basic tier", "unit": "1K emails", "rate": 1.80 },
    { "item": "Overage, Platform tier", "unit": "1K emails", "rate": 1.20 },
    { "item": "Transactional email (Basic tier, effective rate within included volume)", "unit": "1K emails", "rate": 1.50 }
  ]
}
