{
  "provider": "Anthropic",
  "slug": "anthropic",
  "category": "llm",
  "homepage": "https://anthropic.com",
  "pricing_url": "https://www.anthropic.com/pricing",
  "currency": "USD",
  "verified_at": "2026-09-10",
  "source": "openrouter",
  "notes": "Per-token rates as listed on OpenRouter; cross-check headline models against the provider's own pricing page.",
  "rates": [
    {
      "item": "claude-3-haiku",
      "unit": "1M tokens",
      "input": 0.25,
      "output": 1.25,
      "cached_input": 0.03
    },
    {
      "item": "claude-haiku-4.5",
      "unit": "1M tokens",
      "input": 1,
      "output": 5,
      "cached_input": 0.1
    },
    {
      "item": "claude-sonnet-5",
      "unit": "1M tokens",
      "input": 2,
      "output": 10,
      "cached_input": 0.2
    },
    {
      "item": "claude-sonnet-4.6",
      "unit": "1M tokens",
      "input": 3,
      "output": 15,
      "cached_input": 0.3
    },
    {
      "item": "claude-sonnet-4.5",
      "unit": "1M tokens",
      "input": 3,
      "output": 15,
      "cached_input": 0.3
    },
    {
      "item": "claude-sonnet-4",
      "unit": "1M tokens",
      "input": 3,
      "output": 15,
      "cached_input": 0.3
    },
    {
      "item": "claude-opus-5",
      "unit": "1M tokens",
      "input": 5,
      "output": 25,
      "cached_input": 0.5
    },
    {
      "item": "claude-opus-4.8",
      "unit": "1M tokens",
      "input": 5,
      "output": 25,
      "cached_input": 0.5
    },
    {
      "item": "claude-opus-4.7",
      "unit": "1M tokens",
      "input": 5,
      "output": 25,
      "cached_input": 0.5
    },
    {
      "item": "claude-opus-4.6",
      "unit": "1M tokens",
      "input": 5,
      "output": 25,
      "cached_input": 0.5
    },
    {
      "item": "claude-opus-4.5",
      "unit": "1M tokens",
      "input": 5,
      "output": 25,
      "cached_input": 0.5
    },
    {
      "item": "claude-fable-5.1",
      "unit": "1M tokens",
      "input": 10,
      "output": 50,
      "cached_input": 0.25
    },
    {
      "item": "claude-fable-5",
      "unit": "1M tokens",
      "input": 10,
      "output": 50,
      "cached_input": 1
    },
    {
      "item": "claude-opus-4.1",
      "unit": "1M tokens",
      "input": 15,
      "output": 75,
      "cached_input": 1.5
    },
    {
      "item": "claude-opus-4",
      "unit": "1M tokens",
      "input": 15,
      "output": 75,
      "cached_input": 1.5
    }
  ]
}
